{
  "structured_input": true,
  "provider_access": true,
  "interactive": false,
  "supervisory_control": false,
  "adapter": {
    "kind": "codex",
    "native_version": "1.2.3",
    "implementation_version": "symmetry-daemon:1",
    "protocol_version": 1,
    "operations": {
      "start": true,
      "events": true,
      "cancel": true,
      "resume": false,
      "handoff": false,
      "guidance": "next_turn",
      "pause": "unsupported",
      "approval_response": false,
      "usage": "unknown",
      "hard_cost_limit": false
    }
  }
}
